Image_URL,Product_Title,Product_Manufacture,Product_Price,Product_Per_Price,Product_Usage,Product_Precautions,Product_Ingredient_Information,Review
"https://cloudinary.images-iherb.com/image/upload/f_auto,q_auto:eco/images/vtp/vtp00508/v/57.jpg","Vital Proteins, 콜라겐 펩타이드, 무맛, 567g(1.25lbs)",Vital Proteins (바이탈 프로틴스),"₩66,662","₩2,380/제공량",8fl oz의 음료에 1~2스쿱을 넣은 후 잘 섞어 주십시오.,"임신 또는 수유 중이거나 질병이 있는 경우, 섭취하기 전에 의사와 상담하십시오.
보관 방법: 서늘하고 건조한 곳에 보관하십시오.
밀봉 포장이 파손되었거나 없는 경우 섭취하지 마십시오.
이 제품은 보충제로만 복용하십시오. 체중 감량을 위해 사용하지 마십시오.
내용물은 부피가 아닌 중량 단위로 포장됩니다. 내용물이 가라앉을 수 있습니다.",20000.0mg,"물이나 쥬스, 커피에 타서 드셔도 되고 맛도 없고 쫀득쫀득한 스푼(숟가락)으로 떠서 드시면 좋아요. 저에게는 파즈르 기도 후를 선호해서 2시간 전에는 아침식사가 식욕을 돋구기 때문에 먹지 않습니다. 비바돌 박스와 함께 사진으로 크기를 짐작케 하는 사진입니다. 내 의견은 당신에게 유용합니다 (나는 신에게 사람들을 사랑하고 그들은 사람들에게 유익합니다)
나의 새로운 루틴 중에는 나의 사랑이 있습니다 ... 당신은 그것이 당신의 모든 것에 영양을 공급하는 것처럼 느끼는 것, 특히 그 색을 거의 통일하고 생명, 신선함, 공급이 된 내 피부 🧖🏽‍♀️ .. 그리고 내 머리카락이 활력이되고 내 손톱이 더 강해 졌어요 ... 피부, 머리카락, 손톱에 여러 가지 비타민을 함께 사용했습니다 .. 저는 제 피부, 특히 그 문제에 맞는 케어 루틴을 따르고 있습니다. 제 말은 무작위 제품을 복용하지 않습니다. 모든 일에 변화가 일어 났고, 일상이 나에게 어울리기 때문에 하나님을 찬양하되 몸이 흡수되도록 내려 놓으십시오. 그래서 5 월에는 비타민 C 발포 약입니다.
미용사의 추천으로 샀습니다. 맛이 걱정 되서 역 겨울 줄 알았는데 냄새도 거의없고 냄새도 거의 없어서 행복 했어요! 약간 끈적한 층이 입술에 남아 있습니다. 덩어리없이 쉽게 물에 녹습니다. 약간 따뜻한 물에 녹입니다. 내 리뷰가 도움이 되었으면 '예'를 입력하십시오. 감사! 건강!
내 머리카락은 길고 허리까지 길다. 이번 겨울은 끔찍한 머리카락이 떨어지기 시작했습니다. 탈모와 모발 성장, 보충제 품질에 대한 독립적 인 실험실 연구, 내분비 학자와 상담 한 다양한 계획을 읽은 후 효과적인 계획을 얻었습니다. 나는 약 3 개월 동안 약을 마셔야했다. 결과-머리카락이 줄무늬를 멈추고 미용사는 좋은 언더 코트를 발견했습니다). 1. 아침 식사 전 1 시간-콜라겐 펩타이드 + 아미노산 L- 라이신 + L- 프롤린 1000 mg + 비타민 C 2. 아침 식 사용-오메가 3 (2000) + 비타민 D (유지 관리 용량은 5000 IU입니다). 3. 점심-비오틴 10,000 mcg + 비타민 A 10,000 IU. 4. 저녁 식사-비타민 E-1 캡. 5. 저녁 식사 후 1 시간-킬레이트 아연-2 정. 계획이 시작될 때 철분 결핍 빈혈이 없었습니다. 페리틴 수치는 정상이었고 비타민 D 결핍은 없었습니다 (이것은 중요합니다!). 부족한 조건이있는 경우 해당 조건을 해결하고 제거하십시오. 그리고 갑상선 기능 항진증이 있으며 호르몬 약을 사용하지 않습니다. 내 프로필에 나와있는 다른 약을보십시오. 유용하다면 다행입니다.
나는 9.5 세 딸을 위해이 단백질을 샀습니다. 우리는 물 1컵당 1스쿱 × 티보트 1/4 아스코르브산나트륨(비타민 C)을 마시므로 더 잘 흡수됩니다. 그녀의 눈 아래 소녀의 다크 서클이 사라졌습니다. 나는 더 잘 먹기 시작했고, 내 머리카락에 빛이났습니다. 그렇지 않으면 그들은 짚과 같았고 여전히 무겁게 떨어졌습니다. 이 약의 효과가 누적되기 때문에 우리는 적어도 반년 동안 마실 것입니다. 나중에 우리의 변경 사항에 대해 더 많이 쓸 것입니다. 또한 내 여동생은 영양사가 처방한 대로 이 단백질을 마셨습니다. 낮은 헤모글로빈과 낮은 단백질 수치 때문에 처방을 받았고, 그녀는 위치에 있었기 때문에 영양과 함께 이 단백질을 따로 섭취해야 했습니다. 또한 이 단백질의 구성도 8개의 아미노산으로 구성되어 있어서 마음에 들었습니다. 구성이 화려합니다. 모두에게 추천합니다. 제 리뷰가 도움이 되었기를 바랍니다.
오늘 나는이 콜라겐을 시험해 보았습니다. 아주 맛있어요. 나는 Tatyana Shakhvorostova의 추천으로 그것을 샀다. 나는 그녀의 계획에 따라 똑같이 마실 것입니다. 공복에 아침과 잠자리에 들기 전에 저녁에. 나중에 결과에 대해 쓰겠습니다. 당신이 맛을 의심한다면, 그것은 완벽하게 취합니다. 예, 맛있다고 말할 수 있습니다.
미친, 미친, 미친 피부, 머리카락 및 손톱. 길고 부서지지 않습니다. 나는 새로운 결과를 보았습니다. 나는 당신에게 조언합니다. 놓치지 마십시오. 당신은 내가 피부를 열도록기도합니다. 그것은 다음과 같이 설명되었습니다. 물론 가장 좋은 점은 위장이 가볍다는 것입니다."
"https://cloudinary.images-iherb.com/image/upload/f_auto,q_auto:eco/images/vtp/vtp00509/v/37.jpg","Vital Proteins, 콜라겐 펩타이드, 무맛, 284g (10oz)",Vital Proteins (바이탈 프로틴스),"₩38,294","₩2,735/제공량",8fl oz의 음료에 1~2스쿱을 넣은 후 잘 섞어 주십시오.,"주의: 이 제품은 보충제로만 복용하십시오. 체중 감량을 위해 복용하지 마십시오.
임신 또는 수유 중이거나 질병이 있는 경우, 복용하기 전에 의사와 상담하십시오.
보관 방법: 서늘하고 건조한 곳에 보관하십시오.
안전 밀봉 포장이 파손되었거나 없는 경우 복용하지 마십시오.
내용물은 부피가 아닌 중량 단위로 포장됩니다. 내용물이 가라앉을 수 있습니다.",20000.0mg,"물이나 쥬스, 커피에 타서 드셔도 되고 맛도 없고 쫀득쫀득한 스푼(숟가락)으로 떠서 드시면 좋아요. 저에게는 파즈르 기도 후를 선호해서 2시간 전에는 아침식사가 식욕을 돋구기 때문에 먹지 않습니다. 비바돌 박스와 함께 사진으로 크기를 짐작케 하는 사진입니다. 내 의견은 당신에게 유용합니다 (나는 신에게 사람들을 사랑하고 그들은 사람들에게 유익합니다)
나의 새로운 루틴 중에는 나의 사랑이 있습니다 ... 당신은 그것이 당신의 모든 것에 영양을 공급하는 것처럼 느끼는 것, 특히 그 색을 거의 통일하고 생명, 신선함, 공급이 된 내 피부 🧖🏽‍♀️ .. 그리고 내 머리카락이 활력이되고 내 손톱이 더 강해 졌어요 ... 피부, 머리카락, 손톱에 여러 가지 비타민을 함께 사용했습니다 .. 저는 제 피부, 특히 그 문제에 맞는 케어 루틴을 따르고 있습니다. 제 말은 무작위 제품을 복용하지 않습니다. 모든 일에 변화가 일어 났고, 일상이 나에게 어울리기 때문에 하나님을 찬양하되 몸이 흡수되도록 내려 놓으십시오. 그래서 5 월에는 비타민 C 발포 약입니다.
미용사의 추천으로 샀습니다. 맛이 걱정 되서 역 겨울 줄 알았는데 냄새도 거의없고 냄새도 거의 없어서 행복 했어요! 약간 끈적한 층이 입술에 남아 있습니다. 덩어리없이 쉽게 물에 녹습니다. 약간 따뜻한 물에 녹입니다. 내 리뷰가 도움이 되었으면 '예'를 입력하십시오. 감사! 건강!
내 머리카락은 길고 허리까지 길다. 이번 겨울은 끔찍한 머리카락이 떨어지기 시작했습니다. 탈모와 모발 성장, 보충제 품질에 대한 독립적 인 실험실 연구, 내분비 학자와 상담 한 다양한 계획을 읽은 후 효과적인 계획을 얻었습니다. 나는 약 3 개월 동안 약을 마셔야했다. 결과-머리카락이 줄무늬를 멈추고 미용사는 좋은 언더 코트를 발견했습니다). 1. 아침 식사 전 1 시간-콜라겐 펩타이드 + 아미노산 L- 라이신 + L- 프롤린 1000 mg + 비타민 C 2. 아침 식 사용-오메가 3 (2000) + 비타민 D (유지 관리 용량은 5000 IU입니다). 3. 점심-비오틴 10,000 mcg + 비타민 A 10,000 IU. 4. 저녁 식사-비타민 E-1 캡. 5. 저녁 식사 후 1 시간-킬레이트 아연-2 정. 계획이 시작될 때 철분 결핍 빈혈이 없었습니다. 페리틴 수치는 정상이었고 비타민 D 결핍은 없었습니다 (이것은 중요합니다!). 부족한 조건이있는 경우 해당 조건을 해결하고 제거하십시오. 그리고 갑상선 기능 항진증이 있으며 호르몬 약을 사용하지 않습니다. 내 프로필에 나와있는 다른 약을보십시오. 유용하다면 다행입니다.
나는 9.5 세 딸을 위해이 단백질을 샀습니다. 우리는 물 1컵당 1스쿱 × 티보트 1/4 아스코르브산나트륨(비타민 C)을 마시므로 더 잘 흡수됩니다. 그녀의 눈 아래 소녀의 다크 서클이 사라졌습니다. 나는 더 잘 먹기 시작했고, 내 머리카락에 빛이났습니다. 그렇지 않으면 그들은 짚과 같았고 여전히 무겁게 떨어졌습니다. 이 약의 효과가 누적되기 때문에 우리는 적어도 반년 동안 마실 것입니다. 나중에 우리의 변경 사항에 대해 더 많이 쓸 것입니다. 또한 내 여동생은 영양사가 처방한 대로 이 단백질을 마셨습니다. 낮은 헤모글로빈과 낮은 단백질 수치 때문에 처방을 받았고, 그녀는 위치에 있었기 때문에 영양과 함께 이 단백질을 따로 섭취해야 했습니다. 또한 이 단백질의 구성도 8개의 아미노산으로 구성되어 있어서 마음에 들었습니다. 구성이 화려합니다. 모두에게 추천합니다. 제 리뷰가 도움이 되었기를 바랍니다.
오늘 나는이 콜라겐을 시험해 보았습니다. 아주 맛있어요. 나는 Tatyana Shakhvorostova의 추천으로 그것을 샀다. 나는 그녀의 계획에 따라 똑같이 마실 것입니다. 공복에 아침과 잠자리에 들기 전에 저녁에. 나중에 결과에 대해 쓰겠습니다. 당신이 맛을 의심한다면, 그것은 완벽하게 취합니다. 예, 맛있다고 말할 수 있습니다.
미친, 미친, 미친 피부, 머리카락 및 손톱. 길고 부서지지 않습니다. 나는 새로운 결과를 보았습니다. 나는 당신에게 조언합니다. 놓치지 마십시오. 당신은 내가 피부를 열도록기도합니다. 그것은 다음과 같이 설명되었습니다. 물론 가장 좋은 점은 위장이 가볍다는 것입니다."
"https://cloudinary.images-iherb.com/image/upload/f_auto,q_auto:eco/images/sre/sre01018/v/64.jpg","Sports Research, 콜라겐 펩타이드, 무맛, 454g(16oz)",Sports Research (스포츠 리서치),"₩47,400","₩1,040/제공량",보충제로서 건강한 성인은 하루 1회 1스쿱을 좋아하는 음료나 음식에 잘 섞어 섭취하십시오.,"주의: 본 제품은 보충제로만 복용하십시오. 체중 감량을 위해 복용하지 마십시오. 콜라겐은 완전한 단백질이 아닙니다. 당사의 콜라겐 펩타이드에는 FALCPA에서 밝힌 8가지 주요 알레르기 유발 성분이 함유되어 있지 않습니다.
보관 방법: 건조한 곳에 실온 보관하십시오. 과도한 열, 추위, 습기, 직사광선을 피해 보관하십시오.
주의: 어린이와 반려동물의 손이 닿지 않는 곳에 보관하십시오. 특히 임신 또는 수유 중이거나, 질병이 있거나, 처방 약을 복용 중인 분은 본 제품을 복용하기 전에 자격을 갖춘 의료 전문가와 상의하십시오. 일일 권장 복용량을 초과하지 마십시오. 밀봉 포장이 파손되거나 없는 경우에는 복용하지 마십시오.
본 제품은 부피가 아닌 중량 단위로 포장됩니다. 시간이 경과함에 따라 내용물이 가라앉을 수 있습니다. 향기, 색상, 맛 및 용해도가 변할 수 있습니다.",11000.0mg,"단백질의 수준은 심각하게 감시되어야합니다. 75 미만이어야합니다. 콜라겐 펩타이드는이 지표의 정상화에있어 첫 보조자입니다. 비타민 C와 함께 복용하여 빈혈이 없는지 확인하십시오. 그렇지 않으면 리셉션이 쓸모 없게됩니다. 읽으면 '예'를 클릭하십시오. 고마워.
분석에 따르면 한 달간 섭취 한 후 단백질이 증가하고 대포가 더 많이 나타났습니다. 그러나 그의 취향은 불가능합니다. 처음에는 향이없는 항아리를 가져 와서 발포성 비타민 C에 녹여 마 셨습니다. 맛은 참을 수 있었다. 그런 다음 비타민 C 과정이 끝나면 오렌지 주스에 첨가되었습니다. 주스가 더 비싸고 펄프가 있으면 더 적습니다. 주스가 매우 액체이거나 커피에 첨가되면 개그 반사 만하십시오. 날고기가 들어간 뼈가 맛있어요! 그녀는 맛이 더 나아지기를 희망하면서 초콜렛을 두 번 먹었습니다. 그러나 더 나빠졌습니다! 나는 따뜻한 우유에 그것을 넣고 가루는 전혀 휘젓 지 않았으며 맛은 코코아의 약간의 혼합물로만 끔찍했습니다. 파우더가 매우 길기 때문에 코를 꼬집는 것은 도움이되지 않습니다. 이 공포를 마시는 법을 모르겠어요. 주스에 초콜릿을 넣지 마세요.
울 엄만 못된 치매랑 욕창이랑 함께. 24시간 침대에 만 계시니 .당신 꼬리뼈에 있는 욕창이 어느덧 동그랗게 구멍을 만들어 놓았다.음식에서의 콜라겐은 한계가 있다.난 엄마에게 빠르게 새살이 돋아나고 저 구멍을 없애야한다.치매 때문에 인지능력이 없는. 엄마는 영양제도 병원약도 독약이라고 강하게 거절하신다 난 이것을 커피에 찌개에 그리고 모든 야채무침에 볶음에 사정없이.무색 무미인데 이것을 찌개에 넣으면 더 맛있는 이유가 무엇일까?
나는 많은 엑스트라를 먹을지라도 나는 아침에 30 분 전에 아침에 깡통을 잘라서 맛을 위해 BCAA를 추가했다. 나는 피부에 많은 차이를 보지 못했다. 보충제를 사용하고 많은 크림을 사용하십시오. 이 일을 그만둬 라. 하지만 한 달 후, 나는 어린 머리카락이 많았다는 것을 알아 차 렸습니다. 나는 머리카락을 꼬리에 clean었을 때 앞면에 매우 눈에 띄었습니다. 마치 프린지처럼))) 우리는 새로운 캔을 사야 할 것입니다!
나를위한 콜라겐은 주로 단백질과 우수한 수면제의 공급원입니다. 음, 동시에 관절을 돕고 손톱을 강화한다면 왜 안되죠? 이제는 끊임없이 받아 들일 수 없으며 몇 일 안에 시간을 할 수 있고 심지어는 덜 자주 할 수 있습니다. 수면제로, 때로는 아침 갑옷으로 피어싱. 왕성한 아침 식사보다 더 나쁘지는 않습니다. 그것은 검은 플라스틱 단지에 있습니다. 재고가 인색합니다 - 제조사는 콜라겐 사용을 다음과 같이 제안합니다 : 커피 / 차의 구성. 커피로, 나는 특히 사랑에 빠졌습니다. 오렌지 주스 (왜 오렌지인지 궁금합니다.), 단백질 칵테일. 그리고 그것은 음식, 즉 죽, 요구르트 또는 심지어 수프에 개재 될 수 있습니다. 그것은 물속에 빨리 녹습니다. 물이 노랗게 변합니다. 맛이 잘 표현되지 않았습니다. 그리고 일부 주스 농축 물이나 레몬 주스를 가면 '콜라겐'맛은 전혀 민감하지 않습니다. 당신이 커피에 있다면, 그가 거기에 있는지 없는지조차 알지 못할 것입니다. 자연스럽게 나는 아침에 마시 며 ""조밀도가 높은 아침 식사에 필적하는 에너지와 포만감을주고 콜라겐에 약간의 주스 또는 레몬을 섞은 후, 잠자리에 들기 전에이 조합으로 인해 나는 졸린다.
콜라겐은 우리에게 필요합니다. 물론 관절과 피부의 유지를 위해. 입학 한 달이 지나면 70 세 할머니에서 20 세 처녀 자리로 변할 것이라는 기대를 크게 할 필요는 없습니다. 우리는 일생 동안 담배를 피우고 마시고 온갖 쓰레기를 먹습니다. 따라서 피부 콜라겐을 회복하는 데 시간이 걸립니다. 이 때문에 물론 포기해서는 안되며 콜라겐은 피부를지나 관절로 이동합니다. 특히 우리는 젊어지지 않고 나이가 들면서 자신을 치유하지 않기 때문에 관절을 아주 잘 지탱할 것입니다. 콜라겐을 지속적으로 또는 적어도 1 ~ 1.5 년에 한 번 코스에서 복용하는 것이 좋습니다. 리뷰가 도움이 되었다면 ""예""를 입력하십시오. 감사합니다 !!!"
