Image_URL,Product_Title,Product_Manufacture,Product_Price,Product_Per_Price,Product_Usage,Product_Precautions,Product_Ingredient_Information,Review
"https://cloudinary.images-iherb.com/image/upload/f_auto,q_auto:eco/images/age/age12162/v/8.jpg","Codeage, 가수분해 멀티 콜라겐 펩타이드, 무맛, 300g(10.58oz)",Codeage (코드에이지),"₩37,443","₩1,248/제공량","성인의 경우 Codeage 멀티 콜라겐 펩타이드 1스쿱을 좋아하는 음료, 커피, 스무디 8~12oz에 섞어 드시면 식단을 업그레이드할 수 있습니다.","임신 또는 수유 중인 경우, 알레르기 또는 질병이 있거나 약물을 복용 중인 경우 이 상품이나 다른 보충제를 복용하기 전에 의사와 상담하십시오. 본 상품은 만 18세 미만에게 적합하지 않습니다.
주의: 이 상품은 보충제로만 복용하십시오. 체중 감량을 위해 복용하지 마십시오. 색상과 냄새는 상품마다 다를 수 있습니다.
내용물은 부피가 아닌 중량 단위로 포장됩니다. 내용물이 가라앉을 수 있습니다. 서늘하고 건조한 곳에 보관하십시오. 상품이 개봉되어 있거나 안전 밀봉이 손상된 경우에는 복용하지 마십시오.
어린이와 반려동물이 접근할 수 없는 곳에 보관하십시오.
단백질의 주요 공급원이 아닙니다.","<re.Match object; span=(241, 248), match='콜라겐 10g'>","나는 이 콜라겐 코스를 1년에 1-2번 마신다. 아침 공복에 아침식사 30~40분 전, 콜라겐 식수 1스쿱을 유리컵보다 조금 더 희석하고 뜨거운 물도 조금 더합니다. 저는 이 콜라겐을 정말 좋아합니다. 효과가 탁월합니다. 피부가 더 단단하고 탄력이 있으며 건조함이 적습니다. 우수한 콜라겐 펩타이드
5가지 콜라겐과 18가지 필수아미노산으로 구성된 콜라겐 코다지와 장단점. 1형은 피부탄력 2형은 관절과 면역 3형은 피부, 혈관, 생체장기 5형은 힘줄, 피부, 면역 10형은 관절, 뼈, 근육, 모발. 이 콜라겐은 전신에 유익한 효과가 있습니다. 그것은 받아들이기 쉽고, 물에 잘 섞이고, 맛이나 냄새가 없습니다. 알레르기를 일으키지 않았습니다. 포장은 미국 비벌리 힐즈에서 생산되었음을 나타냅니다. 5일차에 복용 시 손의 붉어짐과 건조함을 완화하고, 오랜 시간 동안 사라지지 않은 손 피부의 상처를 치유해줍니다. 경추 및 허리 통증을 줄입니다. 좋은 콜라겐 또 주문하겠습니다. 모두 건강하시길 바랍니다.
코드 지 콜라겐은 정말 도움이됩니다. 우리 엄마는 한 달 동안 그것을 사용했고 그녀는 친구와 친척들로부터 많은 칭찬을 받았습니다. 그녀의 얼굴 피부가 더 밝고 부드러워지는 것을 분명히 볼 수 있습니다. 그녀는 더 젊고 건강 해 보입니다. 우리 엄마는 몇 년 동안 Neocell 콜라겐을 사용했지만 Codeage와 같은 명확하고 빠른 결과를 보지 못했고 주로 관절 지원을 위해 Neocell 콜라겐을 사용했습니다. 이제 그녀는 Codeage를 사랑했고 몇 번이고 구매할 것입니다. 코디 지 콜라겐은 피부뿐만 아니라 관절도 지원합니다. 그 냄새는 나쁘지 않고 마시기 어렵지 않습니다. 그 냄새와 맛은 제가 현재 사용하고있는 California Gold Nutrition 콜라겐보다 낫습니다. 두 달 동안 한 병, 그것은 합리적인 가격입니다. 곧 Codeage 콜라겐을 사용하도록 전환하겠습니다. Covid-19 유행병에서 더 나은 가격이 있기를 바랍니다. :디.
나는 내 단백질 쉐이크와 함께 그것을 마신다. 이 콜라겐을 마시면서 느끼는 이점은 피부가 더 밝아지고 수분이 공급되는 것을 느낀다는 것입니다. 포장이 너무 커서 두 달에서 세 달 동안 지속됩니다. 아무맛도 안나서 오늘의 차한잔 하기 좋아요 도움이 되셨다면 손가락 꾸욱 꾸욱~
이 콜라겐은 차, 커피, 물에 희석해도 되지만 저는 물에 희석해서 식전 1시간에 마십니다! 필연적으로 다른 유기체에 대한 한 시간 동안 (나는 권장 사항을 읽었습니다) 그것을 인식하고 동화시킬 시간이 없습니다! 물에 잘 녹는다! 맛이 없고 마시기 쉽습니다. 나는 비타민 C와 함께 술을 마시기 때문에 콜라겐과 결합하여 2배 빠른 흡수! 2개월이면 충분합니다! 나는 30 년 후에 모두에게 추천합니다!)))) 나는 여전히 기다리고 있습니다))))) 사진에서 내 아침 친구)))
훌륭한 제품. 5 종류의 콜라겐이 모두 포함되어 있습니다. 구매하기 전에 제품이 순수하고 농약, 플라스틱, 중금속 등이 없는지 확인하고 싶었 기 때문에 제조업체에 연락하여 BPA가없는 병을 사용하고 있으며 콜라겐이 포함되어 있지 않다는 답변을 받았습니다. 항생제, 호르몬 또는 살충제. 생선 콜라겐으로 사용되는 자연산 도미는 시장 승인을 받기 위해 0.1ppm 미만에서 테스트해야하는 수은을 포함하여 중금속에 대해 테스트되며 일반적으로 0.02ppm 미만으로 테스트됩니다. 나는 보통 운동하기 전에 스무디에 섞고 더 많은 에너지가 필요하면 풀 스펙트럼 히알루 론산, 대나무 추출물 및 Q10을 추가합니다. 내 피부가 더 탱탱 해 보이고 관절이 더 유연하다는 것도 알아 차 렸습니다.
콜라겐은 뼈, 피부, 근육 및 기타 신체 부위의 핵심 구성 요소입니다. I형: 모든 결합 조직에서 발견되는 가장 일반적인 유형 II형: 관절과 추간판(척추의 충격 흡수 역할을 하는 쿠션)에서 발견됨 III형: 망상 섬유의 주요 구성 요소 피부와 혈관에서 발견됩니다. 유형 IV: 신장, 내이 및 수정체의 구성 요소입니다. 이 제품은 뜨겁거나 차가운 음료에 탁월합니다. 나는 매일 모닝 커피에 그것을 가지고 있습니다. 맛이 없고 쉽게 섞입니다. 콜라겐은 머리카락, 피부 및 손톱의 모양을 돕습니다. 이것은 고품질 제품입니다. 내 몸은 이것을 소화하고 이것을 사용하는 차이를 볼 수 있습니다. 모든 것이 그렇듯이 시간이 조금 걸립니다. 지금 몸에 투자하면 나중에 갚을 필요가 없습니다!
나는 콜라겐을 거의 정기적으로 사용하고 1-2주 동안 휴식을 취합니다. 나는 이미 이 사이트에서 많은 다른 콜라겐을 시도했습니다. 이 콜라겐은 다양한 유형의 다중 구성 때문에 제가 선택했습니다. 콜라겐에는 5가지 종류가 있습니다. 즉, 모든 면에서 동시에 작업이 진행됩니다. 이 콜라겐은 사용하기 쉽고 편리합니다. 뚜렷한 맛이나 냄새가 없습니다. 가장 자주 나는 모닝 커피에 첨가합니다. 물과 함께만 사용하는 것은 내가 가장 좋아하는 용도가 아닙니다. 비타민 C로 섭취량을 보충하십시오. 일반적으로 이것은 음료를 준비 할 때 콜라겐에 즉시 추가하는 분말입니다. 아름답고 건강한 모든 사람에게 이 멀티콜라겐을 추천합니다."
"https://cloudinary.images-iherb.com/image/upload/f_auto,q_auto:eco/images/now/now03137/v/10.jpg","NOW Foods, 어드밴스드 UC-II 조인트 릴리프, 베지 캡슐 60정",Now Foods (나우 푸드),"₩31,952",₩479/제공량,매일 취침 전 공복 상태에서 캡슐 1정을 복용하십시오.,"성인 전용 제품입니다. 임신 또는 수유 중이거나, 다른 약물을 복용 중이거나, 질병이 있는 분은 의사와 상의하십시오. 어린이의 손이 닿지 않는 곳에 보관하십시오.","<re.Match object; span=(142, 150), match='콜라겐 10mg'>","정말 효과를 느꼈던 순간! 나는 거의 1 년 동안 다양한 브랜드와 다른 유형의 콜라겐을 마셔 왔습니다. 그러나 명확한 긍정적인 결과는 관찰되지 않았습니다. 나는 우연히 유명한 산부인과 의사 - 내분비 학자의 소셜 네트워크에서이 약의 권장 사항을 보았습니다. 나는 시도했다. 그리고 일반적으로 발생하는 것처럼 개선 사항이 발생하면 어떻게든 즉시 알아차리지 못합니다. 나는 50대, 관절이 아프기 시작했고, 오래 걸은 후에 비틀어서 잠을 잘 수 없었다. 덜 걷기 시작했습니다. 병을 반 정도 마신 후 이미 걸을 때 엉덩이가 느껴지지 않는다는 것을 깨달았습니다! 나는 제한없이 간다! 너무 기쁘다! 관절은 괜찮습니다. 구성은 우수합니다 : 비타민 C, 비타민 D, 히알루론산, 칼슘. 캡슐이 작아서 마시기 좋습니다. 그녀는 또한 MSM을 복용했습니다. 서로 돕자 - 엄지척! 너 - 나! 그리고 나는 당신에게! 나는 항상 이것을한다
그녀는 MSM으로 관절을 복원했습니다. 결과를 판단하기에는 너무 이르지만 전반적으로 긍정적 인 반응을 보입니다. 나는 콘드로이틴과 글루코사민의 과정을 4 개월 동안 반복 할 것입니다. 여기에는 콜라겐 -2 외에 히알루 론산이 들어 있습니다. 피부와 머리카락이 실제로 좋아지고 있지만 과도한 효과는 기대하지 않습니다.
나는 무릎 관절과 관련된 많은 문제를 알고 있습니다. 많은 다른 첨가물을 섭취했지만 관절 뼈를 향한 비 변성 콜라겐 보충제가 발견되었습니다. 나는 3 개월 동안 그것을 마시고 무릎에 대해 불평하지 않고 6 개월 동안 풀 코스를 마신다. 러시아보다 낮으며 오랫동안 마셔야하기 때문에 중요합니다. 나는 공복시에 밤에 한 캡슐을 복용합니다.
변성되지 않은 II 형 콜라겐은 연골 조직의 주요 구조 단백질입니다. II 형 콜라겐의 분해 및 감소는 골관절염의 발생과 관련이 있습니다. 연골은 관절에 유연성과지지를 제공하는 신체의 주요 결합 조직 중 하나입니다. 변성되지 않은 II 형 콜라겐은 연골의 주요 구조 단백질입니다. 힘과 스트레칭에 대한 책임이 있습니다. 정기적으로 운동을하다가 무릎 관절의 신체 활동에 노출되었을 때 감각이 좋아지는 것을 느꼈습니다. 거의 한 달 동안 복용 해 왔지만 제품이 나에게 맞는지 평가할 수 있고 확실히 구매할 것입니다.
부모님을 위해 두 번째로 구입합니다. 물에 붕소 부족으로 인한 관절 문제를 뺀 것입니다. 아빠의 손목이 아프고 엄마의 무릎이 ... 1 개월간 술을 마신 후 통증을 호소하지 않는다는 것을 알아 차리기 시작했습니다))) 그리고 그들은 아프지 않다고 말했습니다! 결론-결과에 만족합니다!
이 UC II는 연골연화증으로 인해 3단계로 정형외과 의사가 표시했습니다. 이 보충제를 복용한 후 큰 개선을 느꼈습니다. 나는 무릎 통증의 에피소드가 적다는 이점을 느낍니다. 그러나 물론 저는 이것을 체육 전문가와 함께 강화하고 동반하는 신체 활동과 결합했습니다. 그러나 고통 없이 다시 달릴 수 있다는 것은 정말 좋은 일입니다. 그것은 내가 올바른 길을 가고 있다는 것을 의미합니다. 이 댓글이 어떤 식으로든 도움이 되었다면 좋아요를 눌러 매우 기쁠 것입니다!!! :)
이 제품에 관련된 모든 전문가에게 감사드립니다. 관절의 가벼움을 다시 느끼고 더 움직이고 유연하게 느껴질 때 좋습니다. 사용 경험은 2 개월이고 적용 1.5 개월 후 결과를 보았습니다. 물론 무릎의 크런치가 사라지지 않았지만 더 눈에 띄게되었습니다. 그러한 빠른 효과를 기 대해서는 안됩니다. 관절의 치료와 예방을 위해 2 개월은 아무것도 아닙니다. 이제 중요한 세부 사항에 대해 : 정기적으로 마시고, 건너 뛰지 말고, 섭취 권장 사항을 따르고, 알코올을 마시지 마십시오. 몸은 UC-II와 함께 충분한 콜라겐 유형 1과 3과 비타민 C를 섭취해야하며 별도로 섭취해야합니다. 그리고 가장 중요한 것은 리셉션과 병행하여 스포츠 또는 댄스에 참여하는 것입니다!
이 제품을 우연히 얻었습니다. 설명과 리뷰가 마음에 들었습니다. 나는 약 2 년 동안 무릎 관절이 아팠습니다. 계속해서 만지면 뜨겁습니다. 관절에 액체가 고여서 다리가 구부러지지 않습니다. 자주 펌프질하고 호르몬을 관절에 주입하는 것은 불가능하지만 질을 위해 내 인생은 파괴적입니다 ... 시도했는데 염증액이 사라지기 시작했고 피부 온도가 정상이고 관절이 구부러져 30 캡슐 만 먹었습니다. 나는 매우 기쁘게 생각합니다. 더 긴 섭취로 결과를 통합 할 것입니다. 추천합니다
올해는 문제가 생겨 아침에는 손가락이 뻣뻣해지고 밤에는 고관절 통증이 느껴지기 시작했습니다. 몸에 도움이 필요하다는 것을 깨달았습니다. 나는 글루코사민과 2형 콜라겐과 함께 콘드로이틴을 섭취해야 한다고 문헌에서 읽었습니다! 사이트 덕분에 합리적인 가격으로 모든 것을 찾았습니다. 액션 할인도 받았습니다! 나는 지시에 따라 모든 것을 복용하기 시작했습니다! 정말 기대되는 효과가 있길 바라며, 오래오래 복용하겠습니다! 글쎄요, 체육은 물론 맞습니다!"
"https://cloudinary.images-iherb.com/image/upload/f_auto,q_auto:eco/images/irw/irw57986/v/30.jpg","Irwin Naturals, Collagen-Pure, 딥 티슈, 액상 소프트젤 80정",Irwin Naturals (어윈 내추럴스),"₩35,593","₩2,002/제공량",사용법: (성인) 하루 액상 소프트젤 5정을 여러 번에 나누어 물 한 잔과 함께 복용합니다.,"안전 밀봉이 손상된 경우에는 복용하지 마십시오. 본 제품은 천연 카페인을 함유하고 있습니다. 약물을 복용 중이거나 심장병, 고혈압, 철분 결핍, 간 장애 등의 질병이 있거나 간 문제를 나타내는 증상이 발생하는 경우(복통, 어두운 소변색 또는 황달), 이 제품을 복용하기 전에 의사와 상의하십시오. 담관 폐색증이 있는 경우 복용하지 마십시오. 임신 중 또는 임신을 계획 중이거나 수유 중인 경우에는 복용하지 마십시오. 일일 권장 복용량을 초과하지 마십시오. 만 18세 미만은 복용하지 마십시오. 어린이의 손이 닿지 않는 곳에 보관하십시오. 서늘하고 건조한 곳에 보관하십시오.","<re.Match object; span=(158, 163), match='콜라겐 2'>","이 콜라겐 효과 대만족! 나는 아침 식사 30분 전에 2캡슐을 섭취합니다. 이것은 구성의 특정 아미노산 세트 때문입니다. 복용 1개월 후 팔 관절의 통증이 사라졌습니다. 복용 2개월 후 - 피부 상태가 많이 개선됨, 3개월 후 - 그녀는 새로운 모발의 성장에 주목했습니다 - 이 조성물에는 또한 비오틴 및 많은 추가 성분이 포함되어 있습니다 여성의 아름다움과 건강을 위한 ""빵""! 나는 모두에게 구매하는 것이 좋습니다. 나는 지속적으로 그것을 섭취할 것을 권장합니다: 3개월의 음주와 3번의 휴식. 그러나 25년 후에 콜라겐 생성이 감소하기 때문에 항상 그것을 둡니다! 매우 추천하는!!! 읽어주셔서 감사합니다. 도움이 되셨다면 ""예""를 입력하세요.
프로필 전체 은행 (에도 비타민 D3 칼슘 톱 이에). 절반으로 감소 만 용량 (나를 위해 5 캡슐 - 조금 너무 많이, 그것의 조성 및 관심 제공). 조성은 우수합니다, 당신은 피부와 관절에 필요한 모든 것을 (더 칼슘이되었을 것이다, 그것은 아주 좋은 것입니다). 음, 부작용을 허용하지 않습니다. 우리는 확실히 말할 수는 없지만, 피부 상태의 감각 (나는 아토피 성 피부염, 알레르기가 - 따라서 영원한 건조 및 기타 문제를) 더 나았다. 얼굴에 그것은 또한 더 나은 모습이되었다. 만족. 더 이상 주문하지만, 동일한 제조업체에서 지금 주문 녹색 야채, 나는 시도 할 것이다.
나는이 제품에 매우 만족하고있다. 그는 일한다. 나는 Shakvorostovoi T.의 권고에 따라 머리카락 용 비타민과 함께 복용합니다. 피부가 건조하고 콜라겐이 피부에 닿으면 피부가 벗겨지기 시작합니다. 나는 그것을 아주 좋아한다. 나는 두 번째 달을 받아 들인다. 1 년에 2 번 3 개월의 과정을 마셔야합니다. 나는 여전히 그것을 살 것이다.
나는 그 효과가 그렇게 빨리 그리고 분명하게 될 것이라고 생각조차하지 않았다. 나는 빈 뱃속에 3 캡슐의 복용량으로 정확히 한 달을 마셔. 비록 5pcs로 추천되었지만, 이것이 많이 보였다. 또한 아미노산과 복잡한 Neocell * 모이스처 라이저 * 글로우 * 매트릭스 스킨이 좋습니다. 그 효과는 나뿐만 아니라 눈에 띄게되었다. 나는 마약을 좋아했고 또 한 달을 마셨다.
이 콜라겐은 매우 기쁘다. 제조사가 권장하는대로 매일 5 캡슐을 마시지 않는다는 사실에도 불구하고 공식이 효과가 있다고 생각한다. 이것은 제가 사이트에서 시도한 콜라겐의 두 번째 유형입니다. 둘 다 매우 효과적이지만 캡슐과 보습 보조제와 심황, 생강, 소나무 껍질 및 유용한 pyrimuly oil이 많이 포함되어있어 더 편리합니다. 4 월 5 일에 접영을 시작한 날에 나는 턱 아래 부위에서 여드름을 피우고 목에 걸리지 않았다. 나는 당황했다. 그러나 받아들이는 것을 멈추지 않았고, probiotics를 추가했다. 3-4 개의 발진과 그 흔적이지나 갔다. 어딘가에서 무언가가 너무 많이 뛰어 올랐다 고 불평한다. 아침에 일어나려고하면 잠에서 깨면 먹으면서 몇 시간 후에 먹습니다.
나는 2018 년 8 월부터 지속적으로 마시고 있습니다. 또한 Shakhvorostovoi T.의 추천에 따라, 하루에 4 조각의 첫 번째 달 : 점심 식사시 2, 저녁 식사시 2. 다음 달 - 점심 시간에 하루에 2 조각. 리셉션 직전과 개인전 이후의 차이는 엄청납니다! 피부가 훨씬 더 좋고 깨끗 해졌고 강한 네일 플레이트 인 매니 큐 어스트도 언급했습니다. 나는 모두를 추천한다!"
"https://cloudinary.images-iherb.com/image/upload/f_auto,q_auto:eco/images/gol/gol12456/v/26.jpg","Garden of Life, 목초사육 Collagen Beauty, 딸기 레모네이드, 270g(9.52oz)",Garden of Life (가든 오브 라이프),"₩36,710","₩1,835/제공량",1스쿱을 음료 6oz에 섞습니다(스쿱 동봉). 어린이는 복용하지 마십시오.,"주의: 다른 보충제와 마찬가지로 특히 임신 또는 수유 중이거나 수술 예정인 경우, 정기적으로 약을 복용하고 있는 경우, 기타 의료적 감독을 받는 경우에는 본 제품을 복용하기 전에 의료 전문가와 상담하십시오.
어린이의 손이 닿지 않는 곳에 보관하십시오. 서늘하고 건조한 곳에 보관하십시오. 안전 밀봉이 손상되었거나 없는 경우 복용하지 마십시오.
콜라겐은 완전한 단백질이 아닙니다. 식이 단백질을 대체하거나 체중 감량을 위해 사용해서는 안 됩니다.
이 제품의 분말 성분의 밀도는 생산 단위마다 자연적으로 다르며 포장 시 용기에 공간이 필요합니다. 시간이 지남에 따라 분말이 가라앉아 용기가 처음 포장되었을 때보다 덜 찬 것처럼 보입니다. 이 제품은 부피가 아닌 중량 단위로 판매됩니다.",15억 CFU,"콜라겐은 아침 식사 1시간 전 공복에 섭취해야 합니다. 나는 제조업체의 모든 권장 사항을 순종적으로 따랐습니다. 탄산수에 희석하는 것이 특히 시원합니다. 거품이 많이 형성되지만 침전 될 때까지 기다려야하는 즐거운 레모네이드로 판명되었습니다. 나는 거의 한 달 동안이 콜라겐을 마셨지 만 외모에 근본적인 변화는 없었지만 모든 것이 전과 같았습니다. 유용한 물질로 피부와 머리카락에 영양을 공급하고 건강한 기능을 지원하기를 바랄뿐입니다. 나의 몸. 그 후 콜라겐은 이 보충제를 최소 3개월 동안 마시는 것이 좋기 때문에 다른 콜라겐을 구입했습니다. 하지만 슬프게도... 결과가 보이지 않습니다.
나는 이 콜라겐 코스를 1년에 1-2번 마신다. 아침 공복에 아침식사 30~40분 전, 콜라겐 식수 1스쿱을 유리컵보다 조금 더 희석하고 뜨거운 물도 조금 더합니다. 저는 이 콜라겐을 정말 좋아합니다. 효과가 탁월합니다. 피부가 더 단단하고 탄력이 있으며 건조함이 적습니다. 우수한 콜라겐 펩타이드
훌륭한 콜라겐. 예전에 중성적인 맛으로 찍어 먹었는데 못 먹었어요. 이것을 시도하기로 결정했습니다. 맛은 나쁘지 않지만 구성은 일반적으로 최고입니다. 콜라겐 외에도 비타민 C와 비오틴이 추가됩니다. 나는 확실히 더 주문할 것입니다. 결과에 만족합니다. 제 리뷰가 도움이 되셨다면 좋아요 눌러주세요))
이것은 내가 정제로 그것을 마시기 전에 나의 첫 번째 가루 콜라겐입니다. 그러나 어쩐지 효과가 나쁘게 느껴졌다. 나는 할인에 야유하고이 옵션을 시도하기로 결정했습니다. 나는 역겨운 것을 마시는 것보다 더 나쁜 것이 없기 때문에 맛없이 마시는 것이 두렵습니다. 그리고 그들에 대한 리뷰에서 그들은 종종 마시는 것이 불가능하다고 씁니다 (특히 물고기). 이것은 유피 또는 발포성 비타민과 같은 맛입니다. 셰이커에서 치십시오. 스테비아의 뒷맛이 약간 있습니다. 그리고 그 후에도 약간의 화학적 트림이 있지만 맛은 모두 자연적입니다. 정제보다 훨씬 많은 양의 콜라겐 펩타이드뿐만 아니라 천연 비오틴과 비타민 C의 구성도 만족스럽습니다. 결과가 더 눈에 띄기를 바랍니다. 항아리가 반이나 찼습니다. 왜 이렇게했는지 명확하지 않습니다. 숟가락을 꺼내는 것이 편리하기 위해 분명히 🏼‍ 클릭하십시오.
나는 콜라겐을 좋아한다. 나는 그 이점을 본다. 나는 성분을 분석하고 가장 좋은 것을 선택한다. 이 콜라겐: 20개(많지 않은) 펩타이드의 12개(화려함), 비오틴, 비타민 C, 유산균 성분의 구성(훌륭함) . . 히알루론산만 빠진게 아니라 한번에 다 나오는 경우는 드물어요 아주 좋은 제품이에요 꼭 다시 말씀드릴게요 :) 왜 필요한가요?? 콜라겐은 피부의 수분함량을 증가시켜주고 세포를 통해 수분이 분포되기 때문에 피부가 팽팽해지고 얼굴 윤곽이 개선되고 주름이 줄어들고 매끄럽게 되며 콜라겐은 또한 외부의 부정적인 영향으로부터 모발을 보호하고 갈라진 끝을 제거하며 모발에 윤기를 주고 굵게 만들어 탈모를 예방합니다. 여성을 위한 콜라겐은 특히 체중 감량과 관련이 있을 수 있으며 체중 감량에 탁월합니다. 게다가 낮 동안의 졸음을 완화하고 기억력에도 긍정적인 영향을 미치고 수면에도 긍정적인 영향을 미칩니다. 그게 전부입니다!! ! 이 약의 모든 장점을 직접 보고 여러분께 추천합니다!! 힘들지 않다면 좋아요)
나는 사이트에서 다른 콜라겐을 시도합니다. 이것은 괜찮습니다. 나는 지속적으로 콜라겐 보충제를 먹고 있기 때문에 결과를 판단하기 어렵습니다! 콜라겐은 근육의 탄력과 피부의 탄력을 유지하는 구조적 지지체 역할을 합니다. 나이가 들어감에 따라 합성이 감소하고 피부와 근육이 볼륨과 탄력을 잃기 시작하며 주름이 나타납니다. 이때 콜라겐을 추가로 섭취하는 것이 좋습니다. 식단에 대해 확신이 서지 않는 경우 신체와 피부를 지원하는 좋은 방법입니다. 콜라겐 보충제는 식단에서 단백질의 양이 적고 영양소의 양이 부족한 경우 사용할 수 있습니다. 탄력있는 근육과 피부를 원한다면 - 콜라겐이 함유된 식품 보조제로 몸을 지탱하십시오. 여행 중이거나, 스트레스를 받거나, 장 문제가 있거나, 제한적인 식사를 하는 경우에 특히 유용합니다. 내 페이지에서 내 다른 리뷰도 읽으십시오. 이는 귀하에게 유용할 것입니다! 그리고 클릭은 보상에 유용합니다!
위대한 콜라겐 뷰티. 그것은 딸기 compotier처럼 맛. 저어 약 5 분간 그대로 두어 콜라겐을 녹입니다. 일주일에 처음 복용했을 때, 내 건조한 피부 (46 세)는 점점 더 많은 크림을 요구하지 않았지만 영양 보충되었습니다. 나는 3 주간 마셔. 보습 효과가 증가했습니다. 작은 주름이 부드럽게 나타납니다. 권장 사항."
