Image_URL,Product_Title,Product_Manufacture,Product_Price,Product_Per_Price,Product_Usage,Product_Precautions,Product_Ingredient_Information,Review
"https://cloudinary.images-iherb.com/image/upload/f_auto,q_auto:eco/images/cgn/cgn01863/v/71.jpg","California Gold Nutrition, 가수분해 해양 콜라겐 펩타이드, 무맛, 200g(7.05oz)",California Gold Nutrition (캘리포니아 골드 뉴트리션),"₩25,309",₩569/제공량,"매일 한 스쿱(5g♦)을 상온의 물 또는 주스 6~8fl oz에 넣어 잘 섞으십시오(최상의 효과를 얻으려면 블렌더 병에 넣어 섞으십시오). 적어도 식사 1시간 전 공복에 복용하거나, 식사 2시간 후에 복용하거나 의료 전문가의 권고에 따르십시오.","어린이의 손이 닿지 않는 곳에 보관하십시오. 보충제를 복용하기 전에 면허가 있는 의사, 약사, 자연 요법 의사, 기타 자격을 갖춘 의료 전문가와 상의하십시오.
안전 밀봉된 상품입니다. 안전 밀봉이 손상되거나 없는 경우에는 복용하지 마십시오. 20°C~25°C(68°F~77°F) 범위로 온도가 조절되는 실내에 보관하는 것이 좋습니다. 직사광선에 장시간 노출하거나 온도 및 습도가 높은 곳에 장기간 두는 등 상품을 부적절하게 보관하면 시간이 지남에 따라 상품의 품질이 저하될 수 있습니다.
향, 색상, 농도, 맛은 조금씩 다를 수 있습니다.
본 제품은 부피가 아닌 중량 단위로 포장 및 판매됩니다. 시간이 지남에 따라 침전이 발생할 수 있습니다.
주의: 이 제품은 보충제로만 복용하십시오. 체중 감량을 위해 섭취하지 마십시오.",5000.0mg,"콜라겐이 관절염에도 효과가 있다고하지만 사실 관절염에 효과적인건 비변성 2형 콜라겐이라 관절염때문에 콜라겐 섭취하시는분은 비변성 콜라겐을 구매하시는편이 더 도움이 될거예요 다만 피쉬콜라겐을 꾸준히 섭취하면 피부노화와 근육 강화에 효과를 볼 수 있습니다 20대 이후부터 체내에서 합성되는 콜라겐의 양보다 몸 밖으로 빠져나가는 콜라겐이 더 많아지는데요 40대에는 20대의 절반 밖에 되지않는 콜라겐만 남는다고합니다 심지어 폐경기엔 잃는 속도가 훨씬 빨라지고요 한때는 콜라겐을 섭취하면 다른 단백질처럼 소화가 될 뿐이라는 얘기가 많았지만 지난 몇년동안 콜라겐 섭취가 실제로 피부탄력에 큰 향상을 준다는 연구가 계속 나오고 있습니다 지금 먹은지 한달정도 되고있는데 요즘 피부가 좋다는 소리를 많이 듣고있어요 부모님은 물에 타드셔도 맛이 거의 느껴지지않는다고 잘 드시구요 저는 쥬스에 타먹고있는데 콜라겐을 타먹어도 그냥 쥬스맛이라 먹기가 좋아요 단백질과 함께 섭취하면 흡수에 방해를 줄 수 있어 식사시간 한두시간전 공복에 섭취하는게 좋습니다
안녕 내 사랑! 많은 긍정적 인 리뷰를 읽은 후 이러한 해양 콜라겐 펩티드를 구입했습니다. 친구들에게 글을 쓰고 유용한 정보와 비밀을 공유해 주셔서 감사합니다! 친구, 당신은 훌륭합니다 !!! 제 리뷰에 대해 높은 평가를 받아 주셔서 감사 드리며 제 페이지를 방문 해주셔서 감사합니다. 항상 상세하고 유용한 리뷰를 작성하려고 노력합니다. 저는이 해양 콜라겐 펩타이드를 적어도 아침 식사 1 시간 전 공복에 물에 희석하여 3 개월 동안 사용했습니다. 그 사용 결과, 긍정적 인 효과에 매우 만족했습니다. 얼굴에 : 피부가 안쪽에서 영양을 공급 받았고, 상쾌하고, 조여졌고, 더 탄력 있고 매끄러 워졌습니다, 벗겨짐을 멈췄습니다, 눈 근처의 까마귀 발이 사라졌습니다, 팔자 주름이 거의 사라지고, 목이 더 예쁘고, 머리카락이 건강한 빛을 얻었으며, 빠지지 않고, 두꺼워지고 손톱이 강화되었습니다. 주변 사람들은 나의 회춘을 알아 차리고 칭찬을 해주 었는데 정말 기쁩니다! 콜라겐은 모든 장기의 결합 조직의 기초입니다. 우리의 인대, 관절, 근육, 뼈는 그것으로 이루어져 있습니다. 콜라겐은 엘라스틴과 함께 피부 골격을 만들어 피부가 단단하고 탄력있게 보입니다. 약 25 세까지는 콜라겐 문제가 발생하지 않지만 (우리 몸에서 자연적으로 생성됨) 나이가 들면 콜라겐의 양이 크게 감소합니다. 콜라겐의 손실은 노화를 유발합니다. 주름이 형성되고 피부가 건조되고 관절이 굳어지고 크리스마스가되면 무결성과 원래 상태로 돌아가는 능력을 잃고 손톱이 약해지고 머리카락이 칙칙하고 가늘어지며 몸이 가늘어집니다. 그 음색과 모양을 잃습니다. 따라서 콜라겐은식이 보충제의 형태로 섭취해야합니다. 해양 콜라겐은 최고 품질로 간주되며 해양 어류의 피부에서 생산되며 그 구조가 인간 콜라겐과 가장 가깝기 때문에 흡수가 용이하여 몸 전체에 영양 지원을 제공하고 침투하는 능력을 가지고 있습니다. 피부의 깊은 층으로. 관절에 힘과 완충 작용을 제공하고 뼈 구조를 개선하고 근육 성장과 근력을 지원하며 건강한 피부, 모발 및 손톱을 유지하고 신체 및 조직 회복을 개선하며 항산화 보호 및 간 지원을 제공합니다. 이 약은 내가 신뢰하는 품질 기준을 가지고있는 우수하고 신뢰할 수있는 제조업체 ""CGN""에서 나온 것입니다. 아이 허브 자체 브랜드. ITested 품질 인증서. 내가 선택한 다른 보충제, 내가 좋아하는 것, 나는 이전에 내 프로필의 모든 것에 대한 리뷰를 게시했으며, 흥미로운 것들이 많이 있으며, 오랫동안이 사이트에서 구입하는 것을 좋아했습니다. 나는 내 리뷰를 흥미롭고 유용하게 만들려고 노력했습니다. 그가 당신의 선택을 도와 주면 기쁩니다. 제 피드백을 긍정적으로 평가하고 직접 작성하여 정보를 공유해 주신 모든 분들께 감사드립니다. 옛날 옛적에 다른 사용자의 리뷰를 통해 상품을 구매할 때 사이트를 탐색하는 데 도움이 되었기 때문에 그들에게 매우 감사합니다! 모든 친절, 따뜻함, 사랑과 긍정적 인!) 친애하는 친구, 내 리뷰를 지원하십시오. ""예""를 클릭하십시오. 이것은 저를 조금 더 행복하게 만들 것입니다!) 미리 감사드립니다! 환영합니다! 나는 모두를 사랑하고 포옹한다)
분말은 즉시 물에 녹지 않으므로 서두르지 않아도됩니다. 아침에 늦더라도. 나는 항상 10-15 분을 기다립니다. 나는이 시간에 다른 일에 종사하고 있으며 아침에는 모두 꽉 찼습니다. ""빈속에 마시는 것""의 규칙은 엄격히 준수됩니다. 그리고 나는 그것을 먹고 적어도 한 시간 동안 아무것도 먹지 않습니다. 때때로 더. 진흙 냄새와 맛이 있습니다
지금 나이는 30이고 28살부터 먹었는데 이거 먹을때랑 안먹을때랑 다르더라구요 효과가 있어요 피부 결이 20대초 보다 더 좋아요 지금 만나는 사람들마다 피부 너무 좋다는 말 들어요 물에 타먹기 너무 맛없어서 그냥 스쿱채로 입에 털고 바로 물 마셔요 공복시간 지켜먹는거랑 가루날려서 가끔 콧구멍에 들어가는거 그리고 맛도 없어서 먹기 너무 힘들지만 피부생각하면서 먹어요 눠치지않을거에요
피부를 위해서 콜라겐 섭취를 하게됬는데 매일아침  공복에 콜라겐 파우더 한스쿱양을 그대로 입안에 털어넣으면 입자가 너무 고와 목이 메이므로  먹기좋게 두번으로 나눠서 파우더를 먹고 바로  조심히 물을 한두모금 적시듯 머금고 있으면 입안에서 파우더가 바로 녹아 삼키기 좋고 입천장에 달라붙지않아서 먹는데 불편함은 없었고 무향에 무맛인데 미각이 예민하신분들은 파우더가  간혹 비리다지만 몆번 먹다보면 금방 거부감없이 적응할 수 있을겁니다 그리고 콜라겐 흡수에 도움이 된다는 비타민C와 보습에 좋은 히알루론산은 따로 먹고 있었기에 콜라겐UP제품이 아닌 순수 콜라겐 파우더만 들어있는 이제품을 구입했는데 만족합니다 콜라겐 복용은 작년 여름부터 타사제품을  먹다가 1월부터 캘리포니아 콜라겐으로 바꿔먹고 있는데 일단 콜라겐이란 성분들이 서서히 피부에  변화를 주고 있는것 같아요 요즘 마스크를 벗고 지인들과 차나 식사자리를 할때면 다들 얼굴이 좋아졌다고 말들 하는데 어디까지나 제생각이지만 콜라겐과 함께 먹는 레시틴도 의외로 피부에 도움이 되는듯 합니다  그래서 앞으로도 꾸준히  콜라겐 섭취는 할것이고 오전 공복뿐만 아니라 취침전에도 한번 더 섭취후 피부변화를 관찰해보려구요"
"https://cloudinary.images-iherb.com/image/upload/f_auto,q_auto:eco/images/cgn/cgn01864/v/64.jpg","California Gold Nutrition, 가수 분해 해양 콜라겐 펩타이드, 무맛, 500g(17.64oz)",California Gold Nutrition (캘리포니아 골드 뉴트리션),"₩59,065",₩531/제공량,"매일 한 스쿱(5g♦)을 상온의 물 또는 주스 68fl oz에 넣어 잘 섞으십시오(최상의 효과를 얻으려면 블렌더 병에 넣어 섞으십시오). 적어도 식사 1시간 전 공복에 복용하거나, 식사 2시간 후에 복용하거나 의료 전문가의 권고에 따르십시오.","어린이의 손이 닿지 않는 곳에 보관하십시오. 보충제를 복용하기 전에 면허가 있는 의사, 약사, 자연 요법 의사, 기타 자격을 갖춘 의료 전문가와 상의하십시오.
안전 밀봉된 제품입니다. 안전 밀봉이 파손되었거나 없는 경우에는 복용하지 마십시오. 실내 온도 20ºC25ºC(68ºF77ºF) 내에 보관하는 것이 좋습니다. 직사광선, 높은 온도 및 습도에 장기간 노출하는 등 제품을 부적절하게 보관하면 시간이 지남에 따라 제품의 품질이 저하될 수 있습니다.
아로마, 색상, 농도, 맛은 조금씩 다를 수 있습니다.
본 제품은 부피가 아닌 중량 단위로 포장 및 판매됩니다. 시간이 경과함에 따라 침전이 발생할 수 있습니다.",5000.0mg,"콜라겐이 관절염에도 효과가 있다고하지만 사실 관절염에 효과적인건 비변성 2형 콜라겐이라 관절염때문에 콜라겐 섭취하시는분은 비변성 콜라겐을 구매하시는편이 더 도움이 될거예요 다만 피쉬콜라겐을 꾸준히 섭취하면 피부노화와 근육 강화에 효과를 볼 수 있습니다 20대 이후부터 체내에서 합성되는 콜라겐의 양보다 몸 밖으로 빠져나가는 콜라겐이 더 많아지는데요 40대에는 20대의 절반 밖에 되지않는 콜라겐만 남는다고합니다 심지어 폐경기엔 잃는 속도가 훨씬 빨라지고요 한때는 콜라겐을 섭취하면 다른 단백질처럼 소화가 될 뿐이라는 얘기가 많았지만 지난 몇년동안 콜라겐 섭취가 실제로 피부탄력에 큰 향상을 준다는 연구가 계속 나오고 있습니다 지금 먹은지 한달정도 되고있는데 요즘 피부가 좋다는 소리를 많이 듣고있어요 부모님은 물에 타드셔도 맛이 거의 느껴지지않는다고 잘 드시구요 저는 쥬스에 타먹고있는데 콜라겐을 타먹어도 그냥 쥬스맛이라 먹기가 좋아요 단백질과 함께 섭취하면 흡수에 방해를 줄 수 있어 식사시간 한두시간전 공복에 섭취하는게 좋습니다
안녕 내 사랑! 많은 긍정적 인 리뷰를 읽은 후 이러한 해양 콜라겐 펩티드를 구입했습니다. 친구들에게 글을 쓰고 유용한 정보와 비밀을 공유해 주셔서 감사합니다! 친구, 당신은 훌륭합니다 !!! 제 리뷰에 대해 높은 평가를 받아 주셔서 감사 드리며 제 페이지를 방문 해주셔서 감사합니다. 항상 상세하고 유용한 리뷰를 작성하려고 노력합니다. 저는이 해양 콜라겐 펩타이드를 적어도 아침 식사 1 시간 전 공복에 물에 희석하여 3 개월 동안 사용했습니다. 그 사용 결과, 긍정적 인 효과에 매우 만족했습니다. 얼굴에 : 피부가 안쪽에서 영양을 공급 받았고, 상쾌하고, 조여졌고, 더 탄력 있고 매끄러 워졌습니다, 벗겨짐을 멈췄습니다, 눈 근처의 까마귀 발이 사라졌습니다, 팔자 주름이 거의 사라지고, 목이 더 예쁘고, 머리카락이 건강한 빛을 얻었으며, 빠지지 않고, 두꺼워지고 손톱이 강화되었습니다. 주변 사람들은 나의 회춘을 알아 차리고 칭찬을 해주 었는데 정말 기쁩니다! 콜라겐은 모든 장기의 결합 조직의 기초입니다. 우리의 인대, 관절, 근육, 뼈는 그것으로 이루어져 있습니다. 콜라겐은 엘라스틴과 함께 피부 골격을 만들어 피부가 단단하고 탄력있게 보입니다. 약 25 세까지는 콜라겐 문제가 발생하지 않지만 (우리 몸에서 자연적으로 생성됨) 나이가 들면 콜라겐의 양이 크게 감소합니다. 콜라겐의 손실은 노화를 유발합니다. 주름이 형성되고 피부가 건조되고 관절이 굳어지고 크리스마스가되면 무결성과 원래 상태로 돌아가는 능력을 잃고 손톱이 약해지고 머리카락이 칙칙하고 가늘어지며 몸이 가늘어집니다. 그 음색과 모양을 잃습니다. 따라서 콜라겐은식이 보충제의 형태로 섭취해야합니다. 해양 콜라겐은 최고 품질로 간주되며 해양 어류의 피부에서 생산되며 그 구조가 인간 콜라겐과 가장 가깝기 때문에 흡수가 용이하여 몸 전체에 영양 지원을 제공하고 침투하는 능력을 가지고 있습니다. 피부의 깊은 층으로. 관절에 힘과 완충 작용을 제공하고 뼈 구조를 개선하고 근육 성장과 근력을 지원하며 건강한 피부, 모발 및 손톱을 유지하고 신체 및 조직 회복을 개선하며 항산화 보호 및 간 지원을 제공합니다. 이 약은 내가 신뢰하는 품질 기준을 가지고있는 우수하고 신뢰할 수있는 제조업체 ""CGN""에서 나온 것입니다. 아이 허브 자체 브랜드. ITested 품질 인증서. 내가 선택한 다른 보충제, 내가 좋아하는 것, 나는 이전에 내 프로필의 모든 것에 대한 리뷰를 게시했으며, 흥미로운 것들이 많이 있으며, 오랫동안이 사이트에서 구입하는 것을 좋아했습니다. 나는 내 리뷰를 흥미롭고 유용하게 만들려고 노력했습니다. 그가 당신의 선택을 도와 주면 기쁩니다. 제 피드백을 긍정적으로 평가하고 직접 작성하여 정보를 공유해 주신 모든 분들께 감사드립니다. 옛날 옛적에 다른 사용자의 리뷰를 통해 상품을 구매할 때 사이트를 탐색하는 데 도움이 되었기 때문에 그들에게 매우 감사합니다! 모든 친절, 따뜻함, 사랑과 긍정적 인!) 친애하는 친구, 내 리뷰를 지원하십시오. ""예""를 클릭하십시오. 이것은 저를 조금 더 행복하게 만들 것입니다!) 미리 감사드립니다! 환영합니다! 나는 모두를 사랑하고 포옹한다)
분말은 즉시 물에 녹지 않으므로 서두르지 않아도됩니다. 아침에 늦더라도. 나는 항상 10-15 분을 기다립니다. 나는이 시간에 다른 일에 종사하고 있으며 아침에는 모두 꽉 찼습니다. ""빈속에 마시는 것""의 규칙은 엄격히 준수됩니다. 그리고 나는 그것을 먹고 적어도 한 시간 동안 아무것도 먹지 않습니다. 때때로 더. 진흙 냄새와 맛이 있습니다
지금 나이는 30이고 28살부터 먹었는데 이거 먹을때랑 안먹을때랑 다르더라구요 효과가 있어요 피부 결이 20대초 보다 더 좋아요 지금 만나는 사람들마다 피부 너무 좋다는 말 들어요 물에 타먹기 너무 맛없어서 그냥 스쿱채로 입에 털고 바로 물 마셔요 공복시간 지켜먹는거랑 가루날려서 가끔 콧구멍에 들어가는거 그리고 맛도 없어서 먹기 너무 힘들지만 피부생각하면서 먹어요 눠치지않을거에요
피부를 위해서 콜라겐 섭취를 하게됬는데 매일아침  공복에 콜라겐 파우더 한스쿱양을 그대로 입안에 털어넣으면 입자가 너무 고와 목이 메이므로  먹기좋게 두번으로 나눠서 파우더를 먹고 바로  조심히 물을 한두모금 적시듯 머금고 있으면 입안에서 파우더가 바로 녹아 삼키기 좋고 입천장에 달라붙지않아서 먹는데 불편함은 없었고 무향에 무맛인데 미각이 예민하신분들은 파우더가  간혹 비리다지만 몆번 먹다보면 금방 거부감없이 적응할 수 있을겁니다 그리고 콜라겐 흡수에 도움이 된다는 비타민C와 보습에 좋은 히알루론산은 따로 먹고 있었기에 콜라겐UP제품이 아닌 순수 콜라겐 파우더만 들어있는 이제품을 구입했는데 만족합니다 콜라겐 복용은 작년 여름부터 타사제품을  먹다가 1월부터 캘리포니아 콜라겐으로 바꿔먹고 있는데 일단 콜라겐이란 성분들이 서서히 피부에  변화를 주고 있는것 같아요 요즘 마스크를 벗고 지인들과 차나 식사자리를 할때면 다들 얼굴이 좋아졌다고 말들 하는데 어디까지나 제생각이지만 콜라겐과 함께 먹는 레시틴도 의외로 피부에 도움이 되는듯 합니다  그래서 앞으로도 꾸준히  콜라겐 섭취는 할것이고 오전 공복뿐만 아니라 취침전에도 한번 더 섭취후 피부변화를 관찰해보려구요"
"https://cloudinary.images-iherb.com/image/upload/f_auto,q_auto:eco/images/now/now03136/v/27.jpg","NOW Foods, UC-II 관절 건강, 비변성 타입 II 콜라겐, 베지 캡슐 120정",Now Foods (나우 푸드),"₩51,946",₩432/제공량,매일 잠자기 전 공복에 1정씩 섭취하십시오.,"주의: 성인 전용 제품입니다. 임신 또는 수유 중 또는 약물을 복용 중이거나, 질병이 있는 분은 의사와 상의하십시오. 어린이의 손이 닿지 않는 곳에 보관하십시오.
방습제는 먹지 마십시오. 병째로 보관하십시오.
이 제품은 자연적인 색 변화가 발생할 수 있습니다.","<re.Match object; span=(107, 115), match='콜라겐 10mg'>",
"https://cloudinary.images-iherb.com/image/upload/f_auto,q_auto:eco/images/now/now03134/v/29.jpg","NOW Foods, UC-II 관절 건강, 비변성 II형 콜라겐 함유, 베지 캡슐 60정",Now Foods (나우 푸드),"₩27,966",₩466/제공량,매일 취침 전 공복 상태에서 캡슐 1정을 복용하십시오.,"주의: 성인 전용 제품입니다. 임신 또는 수유 중이거나 약물을 복용 중이거나 질병이 있는 경우에는 의사와 상의하십시오. 어린이의 손이 닿지 않는 곳에 보관하십시오.
이 제품은 자연적인 색 변화가 발생할 수 있습니다.","<re.Match object; span=(108, 116), match='콜라겐 10mg'>",
