Image_URL,Product_Title,Product_Manufacture,Product_Price,Product_Per_Price,Product_Usage,Product_Precautions,Product_Ingredient_Information,Review
"https://cloudinary.images-iherb.com/image/upload/f_auto,q_auto:eco/images/sre/sre01091/v/59.jpg","Sports Research, 콜라겐 펩타이드, 무맛, 단일 팩 20개, 각 11g(0.39oz)",Sports Research (스포츠 리서치),"₩44,609","₩1,784/제공량","성인 기준, 매일 1~2회 1팩을 좋아하는 음료나 식사에 넣고 잘 섞어 주십시오. 또는 자격을 갖춘 의료 전문가의 지시에 따르십시오.","주의: 이 상품은 보충제로만 복용하십시오. 체중 감량을 위해 복용하지 마십시오.
어린이와 반려동물이 접근할 수 없는 곳에 보관하십시오. 특히 임신 또는 수유 중이거나 질병이 있거나 처방약을 복용 중인 분은 본 제품을 복용하기 전에 자격을 갖춘 의료 전문가와 상의하십시오. 일일 권장 복용량을 초과하지 마십시오. 개별 밀봉한 팩이 손상되거나 구멍난 경우에는 복용하지 마십시오. 건조한 곳에서 실온 보관하십시오. 과도한 열, 추위, 습기, 직사광선을 피해 보관하십시오.
참고: 향, 색상, 맛, 용해도에 차이가 있을 수 있습니다.",0mg,"이 제품의 가장 유용한 점은 포장입니다. 상자의 내용물은 원인 지침에 따라 일일 콜라겐 양만 포함 된 개별 스틱에 포장되어 있습니다. 콜라겐 자체에 감각이 있는지 이해하려면 적어도 1 년 동안 마셔야한다고 생각합니다. 그런 패키지 중에는 감각이 없을 것입니다
이 저명한 제조업체에서 건강 보조 식품을 주문한 것은 이번이 처음이 아니며 자신있게 추천할 수 있습니다. GMO 없는 천연 원료로 정성껏 만들었습니다. 장기간 사용하기에 충분한 큰 유리한 포장. 효과는 개인차가 있을 수 있으므로 의사의 추천을 받는 것이 좋습니다.
아주 멋진 콜라겐, 맛은 좋지 않지만 눈에 띄게 소화력이 좋아집니다. 나는 매일 아침 공복에 마셨고, 특정한 맛이 먼저 개그 반사를 일으켰고, 그 다음 나는 그것에 익숙해졌다. 그 덕분에 첫 번째 코스인 ""undershorstok""이 나타난 후 모발 성장이 눈에 띄게 개선되었습니다. 그러나 다시 한 번 내 소화가 향상되었음을 강조합니다.이것은 두 번 큰 장점입니다.
아주 멋진 콜라겐, 맛은 좋지 않지만 눈에 띄게 소화력이 좋아집니다. 나는 매일 아침 단식에 술을 마셨고, 특정한 맛이 먼저 개그 반사를 일으켰고, 그 다음 나는 그것에 익숙해졌다. 그것의 도움으로 첫 번째 코스, ""undershorstok""이 나타난 후 모발 성장이 눈에 띄게 향상되었습니다. 그러나 다시 한 번 나는 나의 소화가 개선되었음을 강조할 것입니다. 2배는 큰 장점입니다
콜라겐은 삶에서 중요하고 필요하며 많은 이점이 있습니다 1 콜라겐은 피부에 수분을 공급합니다 ... 2 콜라겐은 피부에 탄력을 부여하는 데 도움이 됩니다 ... 3 콜라겐은 노화를 방지합니다 ... 4 콜라겐은 피부로의 혈류를 증가시킵니다 ... 5 콜라겐 상처 치유에 도움"
"https://cloudinary.images-iherb.com/image/upload/f_auto,q_auto:eco/images/oga/oga00727/v/18.jpg","Orgain, 콜라겐 펩타이드, 무맛, 454g(16oz)",Orgain (올게인),"₩43,404",₩964/제공량,"한 스쿱을 떠서 원하는 음료, 음식 또는 구운 식품과 함께 섭취하십시오.","보관 방법: 뚜껑을 꽉 닫아 서늘하고 건조한 곳에 보관하십시오. 빛, 열, 습기에 노출되지 않도록 하십시오.
임신 또는 수유 중이거나 질병이 있는 경우 섭취하기 전에 의사와 상담하십시오.",10000.0mg,"양질의 제3자 테스트 콜라겐 펩타이드. Vital Protein 브랜드와 동일하게 보입니다. GMP 시설의 제1, 2, 3 콜라겐 패키지의 품질 성분 및 조성. 나는 주스와 모닝 커피와 함께 섭취합니다. 맛을 많이 추가하지는 않지만 질감이 약간 다릅니다. 콜라겐 펩타이드 분말 다이어트에 대한 임상 연구를 통해 좋은 노화 방지 효과와 주름 및 잔주름 개선. 특히 갱년기나 콜라겐 생성이 감소하는 노인들에게 콜라겐을 적당히 섭취하면 좋은 효과를 볼 수 있습니다. 나는 2년 동안 콜라겐 펩타이드 분말을 복용하고 있습니다. 매일 복용합니다. 그리고 내 피부, 손톱이 개선되었습니다. 주름에 관해서는 아마도 나는 눈치 채지 못할 것입니다. 이 브랜드는 또한 상위 10대 브랜드 중 하나입니다. 더 나은 n 더 강한 피부 n 손톱 n 노화 방지 효과를 원한다면 꼭 시도하십시오. 내 리뷰가 유용하다고 생각되면 엄지손가락을 치켜세워 주세요. 감사합니다. 그것은 쉽게 용해되며 Vital Proteins와 매우 유사하고 깨끗하고 좋고 맛이 거의 없으며 neocell과 비교하여 섭취하기 쉽습니다.
콜라겐 처음 사봤는데 맛도 냄새도 없이 아주 맛있어요. 커피에서는 일반적으로 커피를 첨가하는 것이 더 크리미해집니다. 이 병을 3개월 이상 마셔야 합니다. 1.5잔이면 충분합니다. 따라서 Jennifer aniston이 광고하는 대형 Vitals 콜라겐보다 저렴합니다. 그리고 품질면에서 이것은 내가 이해하는 한 전혀 나쁘지 않습니다. 나는 한 달 사용 후 리뷰를 추가하고 있습니다. 이 병은 한 달 반 동안 충분하지 않았고 한 달 반 동안 충분하지 않았습니다. 내 계산에 따르면 더 길어야했기 때문에 매우 속상했습니다. 낮. 매우 비싼 즐거움. 더 주문할지 모르겠습니다.
콜라겐/펩티드를 위한 최고의 브랜드라고 생각합니다. 그것은 물에 완전히 녹습니다(내가 마시는 방법). 맛/냄새가 매우 부드럽습니다. 나는 2개의 다른 브랜드를 시험해 보았고 어, 맛이 끔찍하고 잘 섞이지 않고 매우 강한 냄새가 났습니다. Orgain 브랜드만 구매하겠습니다.
장에 문제가 있는 아들이 단백질 파우더를 원해 유청이 아닌 제품으로 알아보다 구입했어요 막상 먹어보니 맛이 없다고 해서 제가 먹는 중입니다 플레인 요거트에 타서 먹고 있는데 별 맛은 안나지만 살짝 미끌거리는 느낌이랑까…? 표현하기 애매한 맛이 있긴 하네요 그래도 이정도면 큰 불편감 없이 복용할 수 있습니다 속도 편해서 무리없이 먹고 있어요
저는 지금 몇 주 동안 Orgain Collagen Peptides를 사용해 왔으며 이미 제 피부, 머리카락, 손톱에서 눈에 띄는 차이를 보고 있습니다. 이 제품은 놀랍고 사용해 보니 정말 기쁩니다. 무향 파우더는 모닝 커피나 스무디에 섞기 쉽고 뭉치거나 거친 잔여물을 남기지 않고 쉽게 용해됩니다. 무미 무취여서 맛을 바꾸지 않고 어떤 음료나 레시피에도 첨가할 수 있다는 점에 감사합니다. Orgain Collagen Peptides에 대해 제가 가장 좋아하는 점은 건강한 피부, 모발 및 손톱을 촉진하는 데 좋은 고품질의 풀을 먹인 콜라겐 펩타이드로 만들어졌다는 것입니다. 또한 단백질의 좋은 공급원으로 더 오랫동안 포만감을 느끼고 하루 종일 지속적인 에너지를 제공합니다. 이 제품의 또 다른 좋은 점은 글루텐이 없고 콩이 없으며 설탕이나 인공 성분이 첨가되지 않았다는 것입니다. 안전하고 건강한 보충제를 내 몸에 넣고 있다는 자신감이 생깁니다.
콜라겐 처음 사봤는데 맛도 냄새도 없이 아주 맛있어요. 커피에서는 일반적으로 커피를 추가하는 것이 시원하고 더 크림이 됩니다. 최소 3개월 동안 마셔야 합니다. 이것은 1.5분에 충분할 수 있습니다. 나는 한 달 사용 후 리뷰를 추가하고 있습니다. 이 병은 한 달 반이 아니라 한 달 동안 충분했습니다. 내 계산에 따르면 더 길어야했기 때문에 하루에 한 스푼을 마셨기 때문에 매우 화가났습니다. 우수한 품질, 성분, 구성, 포장."
"https://cloudinary.images-iherb.com/image/upload/f_auto,q_auto:eco/images/ogk/ogk25044/v/8.jpg","Organika, Enhanced Collagen, 긴장 완화, 250g(8.82oz)",Organika (올가니카),"₩29,360","₩1,012/제공량","성인 전용 상품입니다. 매일 8.6g(약 1테이블스푼)을 반 컵 이상의 찬물, 주스 또는 선호하는 음료에 섞어 드십시오.","신선도 유지를 위해 서늘하고 건조한 곳에 보관하십시오. 어린이의 손이 닿지 않는 곳에 보관하십시오. 밀봉 포장된 상품입니다. 안전 밀봉이 손상된 경우에는 상품을 복용하지 마십시오.
임신 또는 모유 수유 중이거나, 질병이 있거나, 약물을 복용 중인 경우에는 이 상품을 복용하기 전에 의료 전문가와 상의하십시오. 경미한 위장 장애를 일으킬 수 있습니다.",8600.0mg,"지금까지이 콜라겐은 제가 가장 좋아하는 것입니다! 그를 만나기 전에 나는 공복에 콜라겐을 먹었지 만 저녁에는 잠자리에 들기 전에 먹었습니다. 전통적인 방식이 아닌 아침, 아침 식사 전에. 우리는 구성을 봅니다. 이 옵션에는 흡수를 위한 최상의 글리시네이트 형태의 마그네슘 일일 복용량이 포함되어 있습니다. 혜택: L-테아닌과 마그네슘 글리시네이트는 휴식과 수면을 촉진합니다. 그 결과 수면이 개선되었음을 알게 되었습니다. 수면 시간이 줄어들어도 더 잘 자게 되었습니다. 따라서 동일한 제조업체의 신제품 인 가바 콜라겐을 구매할 계획입니다. 나는 GABA를 따로 복용하고 그 행동이 나에게 미치는 영향을 알고 좋아합니다. 그리고 고품질 쇠고기 콜라겐도 결합하면 비표준 수면 및 각성 요법으로도 여행 중에 평소 예상되는 쉽게 잠들고 좋은 수면을 얻을 수 있습니다. 결국 여름을 앞두고 여행, 비행. 제조업체는 고품질 콜라겐 보충제, 방목, 풀을 먹인 소의 원료를 보유하고 있습니다. 소형 포장. 은행이지만 다른 제조업체와 마찬가지로 부피가 큰 대형 형식은 아닙니다. 내 모든 리뷰는 실제 사진과 함께 제공됩니다. 사이트에서 실제 제품을 보는 데 도움이 됩니다. 좋아요를 받는 것이 좋습니다.
콜라겐은 이미 좋고 마그네슘과 L-테아닌도 있으면 + 이완과 기분입니다. 여기에 Vit를 추가합니다. 히알루론산과 연골 보호제를 사용하면 내 관절에 행복이 있을 것입니다. 머리카락과 피부 모두에 도움이 될 것입니다. 저는 새로운 것을 시도하는 것을 좋아합니다. 동의하는 사람! 지원 해줘.
나는 이 콜라겐을 시도하게 되어 매우 기뻤고 실망시키지 않았습니다. 품질도 좋고, 잘 섞이고, 맛없어서 시리얼과 도시락에 사용하려고요 ㅋㅋㅋㅋ 나는 거의 즉시 편안함을 느꼈다. 그것은 좋은 형태의 마그네슘, 즉 마그네슘 비스글리시네이트와 내가 가장 좋아하는 보충제 중 하나인 L-테아닌을 포함합니다. 각각의 양은 각각 350mg과 250mg으로 꽤 좋습니다. 오가니카 갑니다!!!
임신 후 무릎이 많이 아프기 시작했고 혈액 검사에서 단백질이 적었습니다. 나는 콜라겐을 먹기로 결정했다. 이 브랜드를 구입했습니다-Organika. 무릎 통증이 사라진 지 2 개월 후 분석에 따르면 총 단백질이 증가했습니다. 매우 만족. 콜라겐은 물에 잘 녹고 중성적인 맛이 좋습니다. 나는 추천한다!"
"https://cloudinary.images-iherb.com/image/upload/f_auto,q_auto:eco/images/age/age00830/v/8.jpg","Codeage, Amen, 콜라겐, 베지 캡슐 90정",Codeage (코드에이지),"₩26,069",₩868/제공량,하루에 캡슐 3정씩 물 또는 원하는 음료 8oz와 함께 복용하십시오. 식후 또는 공복에 복용할 수 있습니다.,"권장 복용량을 초과하지 마십시오. 임신부 또는 수유 중인 산모이거나 만 18세 미만이거나 알려진 질병이 있는 경우 본 상품이나 다른 보충제를 복용하기 전에 의사와 상의하십시오. 표시된 성분에 대해 알레르기가 있거나 민감한 경우 주의해서 복용하십시오.
서늘하고 건조한 곳에 보관하십시오. 상품이 개봉되어 있거나 안전 밀봉이 손상된 경우에는 복용하지 마십시오.
어린이와 반려동물이 접근할 수 없는 곳에 보관하십시오.",60.0mg,"합리적인 가격에 이 콜라겐 보충제를 발견하게 되어 정말 기쁩니다. 히알루론산과 비타민 C가 포함되어 흡수와 생체 이용률을 돕습니다. 유형 I 및 III만 포함하는 대부분의 보충제와 달리 모든 유형의 콜라겐(I, II, III, IIII, V, X)이 있습니다. 캡슐은 젤라틴이 아닌 셀로오스이므로 삼키기가 더 쉽습니다. 전반적으로 훌륭한 보충제!
나는 몇 주 동안 아멘 콜라겐 캡슐을 사용해 왔습니다. 제 생각에는 뒷맛이 없습니다. 머리카락이 건조하고 끝이 부러졌고 손톱이 길어지기 시작하면 손톱이 계속 부러졌습니다. 내 머리카락과 손톱은 이미 더 강하고 건강해 보이기 시작했습니다. 지금까지 결과에 만족합니다.
나는 이 캡슐을 음식과 함께 복용하며 위장을 화나게 하거나 불편함을 일으키지 않습니다. 캡슐 크기는 내가 삼키기 매우 쉽습니다. 좋은 맛이 없습니다. 콜라겐 외에 비타민C와 히알루론산을 첨가한 것도 마음에 듭니다. 재료의 아주 좋은 혼합과 인공 첨가물이 없습니다. 나는 나이가 들어서 피부와 머리카락, 손톱을 돕기 위해 이것을 가져갑니다. 실제로 많은 일에 좋습니다. 지금까지 저는 이 보충제와 그 이점에 만족하며 추천할 수 있습니다.
아침저녁으로 아주 만족스럽게 사용하고 있습니다. 나는 노화와 관절, 손톱 및 피부를 돕기 위해 콜라겐을 섭취하는데 이것은 매우 쉽게 섭취할 수 있습니다. 나는 공복에 복용할 수 있고 짜증이나 배탈이 없습니다. 내 라이프 스타일에 딱 맞는 매우 높은 품질의 제품. 나는 한 번에 더 적은 수의 알약을 복용해야 하지만 동일한 이점을 얻기 위해 복용량을 나눕니다. 내 손톱이 더 강해지고 피부가 더 유연해집니다.
나는 Codeage 브랜드 제품을 좋아합니다. 그들은 GMO가 아니며 인공 성분이 없으며 미국에서 제조되었습니다. 여기에는 비타민 C와 히알루론산이 추가되어 비타민을 추가로 섭취하지 않아도 좋습니다. 그것은 내 관절을 도왔고 내 머리카락은 놀랍도록 건강해 보입니다.
머리카락, 피부, 손톱 건강을 위한 콜라겐, 비타민C, 히알루론산 섭취의 이점에 대해 읽어보았습니다. 30대 중반이 되면서 콜라겐 생성량이 낮아지고 피부에도 노화의 영향이 나타나기 시작하고 있어요. 나는 이 보충제가 3가지 성분을 모두 포함하고 있기 때문에 주문하기로 결정했습니다. 나는 저녁 식사 직후 취침 시간에 이 보충제를 복용했는데 메스꺼움이나 불편함을 경험하지 못했습니다. 나는 약 한 달 동안 매일 보충제를 복용해 왔습니다. 그 이후로 나는 눈썹 사이의 잔주름과 입가의 스마일 라인이 거의 완전히 사라진 것을 발견했습니다. 내 피부가 더 밝고 깨끗해 보이고 느껴집니다. 나는 뷰티 부스트를 찾는 사람에게 이 보충제를 추천하고 싶습니다!"
"https://cloudinary.images-iherb.com/image/upload/f_auto,q_auto:eco/images/age/age00047/v/8.jpg","Codeage, 뼈 육수 콜라겐, 캡슐 180정",Codeage (코드에이지),"₩39,706","₩1,323/제공량",성인 기준 하루에 캡슐 6정을 물이나 선호하는 음료 8oz와 함께 복용하십시오. 음식 섭취 여부와 상관없이 복용할 수 있습니다.,"권장 복용량을 초과하지 마십시오. 임신부 또는 수유 중인 산모이거나 병력이 있는 경우에는 이 상품이나 다른 보충제를 복용하기 전에 의사와 상의하십시오. 표시된 성분에 대해 알레르기가 있거나 민감한 경우 주의해서 복용하십시오. 본 상품은 만 18세 미만에게 적합하지 않습니다.
서늘하고 건조한 곳에 보관하십시오. 상품이 개봉되어 있거나 안전 밀봉이 손상된 경우에는 복용하지 마십시오. 어린이와 반려동물이 접근할 수 없는 곳에 보관하십시오.",3000.0mg,"나는 양질의 성분을 함유한 좋은 콜라겐 보충제가 필요했고 이 브랜드를 발견했습니다. 나는 이것의 재료를 좋아하지만 ashwagandha에 대해 약간 걱정했습니다. 나는 훌륭한 회사에서 ashwagandha 보충제를 복용하려고 시도했지만 부정적인 부작용이 있었지만 이것은 나를 괴롭히지 않았습니다. 나는 이미 심황 보충제를 복용하고 있으므로 약간의 추가는 아프지 않습니다. 맛은 전혀 나쁘지 않고 뒷맛도 없습니다. 나는 이것이 삼키기 쉬운 캡슐에 있다는 것을 좋아합니다.
나는 육식 식단을 유지하고 있으며 항상 적절한 영양 섭취 방법을 찾고 있습니다. 나는 과거에 뼈 국물 콜라겐을 섭취했지만 최고 품질의 제품을 얻고 있다는 느낌을 받은 적이 없습니다. 나는 이 브랜드에 매우 충실하며, 뼈 국물 콜라겐 제품이 있다는 사실을 알고 기뻤습니다. 나는 뼈 국물 콜라겐이 뼈, 힘줄, 피부, 연골 및 관절을 지탱하는 데 중요하다는 것을 알고 있으며 이 제품이 나에게 필요한 것을 정확히 제공한다는 것을 알고 자신감을 느낍니다.
OMG - 캡슐은 복용하기 매우 쉽고 콜라겐을 크게 증가시킵니다. 배탈이나 뒷맛 없이 복용할 수 있습니다. 이 브랜드의 캡슐로 보충제의 효과를 높일 수 있는 또 다른 방법을 추가하게 되어 매우 기쁩니다. 이 전에는 캡슐에서 뼈 국물의 이점을 얻지 못했을 것입니다.
이번에도 주문합니다. 다가오는 수술을 위해 체중을 좀 감량해야 합니다. 호르몬 변화 이후로 제 인생의 절반을 봉사하는 시간이 달라졌습니다. ㅋㅋㅋ 체중을 감량하면서 식단에서 콜라겐을 늘리려고 노력할 것입니다. 이점은 널리 알려져 있으며 뼈 국물이 몸에 좋다는 것을 알고 있습니다. 우리 어머니는 1968년에 사골국물이 우리에게 신이라는 것을 알고 계셨습니다! 닭고기나 소뼈를 삶으면 콜라겐이 방출됩니다. 이 콤보에는 나를 선하게 만들고 수면을 돕는 Ashwaganda가 있습니다. 강황과 커큐민은 관절통과 염증을 완화하는 데 도움이 됩니다. 소량으로 심황은 소화를 돕습니다. 나는 개인적으로 많은 양의 심황을 용납할 수 없지만 어떤 사람들은 그것을 맹세합니다. 여기에 있는 금액은 제가 감당할 수 있는 정도입니다.
저는 이 뼈 국물이 풀을 먹여 키우고 목초지에서 키웠으며 추가적인 항염증 성분을 위해 강황을 포함하고 있다는 점을 좋아합니다. 이것은 내 배를 아프게 하지 않았고 내 장 문제에 도움이 되는 것 같았으며 내 피부와 머리카락도 개선되는 것을 볼 수 있었습니다! 6캡슐을 권장하는데 저는 나누어서 매 끼니마다 2캡슐씩 섭취하기가 더 편해요. 이 고품질 뼈 국물 콜라겐 보충제를 일상 생활에 포함시키는 것이 좋습니다.
매일 아침 아이스커피에 콜라겐을 섞어서 마시고 있어요. 일부 콜라겐 분말은 차가운 음료에 잘 섞이지 않지만 이 제품은 잘 섞입니다. 섞으면 맛이 없습니다. 콜라겐은 머리카락이 빨리 자라게 하고 여전히 두껍고 튼튼하기 때문에 나이가 들수록 유익하다고 생각합니다. 훌륭한 품질의 콜라겐 옵션.
나는 식물성 콜라겐보다 뼈 국물 콜라겐을 선호합니다. 나는 소와 가금류 뼈 국물을 좋아하며 여기에는 심황과 같은 다른 재료도 들어 있습니다. 병당 가격만큼의 가치가 있습니다. 캡슐은 복용하기 쉽고 뒷맛이 거의 또는 전혀 남지 않습니다. 나는 Code Age 브랜드에 대한 신뢰를 갖고 있으며 다른 브랜드보다 이를 인수할 것입니다."
"https://cloudinary.images-iherb.com/image/upload/f_auto,q_auto:eco/images/nor/nor01658/v/8.jpg","Nordic Naturals, 노르딕 뷰티, 콜라겐 펩타이드, 무맛, 300g(10.6oz)",Nordic Naturals (노르딕 내추럴스),"₩43,068","₩1,435/제공량",매일 1회 음료 온도와 상관없이 1스쿱을 237ml(8fl oz)의 음료에 섞어 섭취하거나 의료 전문가의 지시에 따르십시오.,"직사광선을 피해 서늘하고 건조한 곳에 보관하십시오. 안전 밀봉이 손상되었거나 없는 경우 복용하지 마십시오. 어린이의 손이 닿지 않는 곳에 보관하십시오.
질병이 있는 경우, 약물을 복용 중인 경우에는 본 제품 또는 다른 보충제를 복용하기 전에 의사와 상의하십시오.
알림: 이 제품은 보충제로만 복용하십시오. 체중 감량을 위해 복용하지 마십시오.",10000.0mg,"이것은 좋은 품질의 콜라겐 I 및 III 분말입니다. 파우더콜라겐은 처음 써보네요. 저는 40세이고 콜라겐 수치를 유지하려고 노력합니다. 피부에 수분과 탄력을 제공합니다. 빨리 녹는다..고체 상태에서는 냄새가 안나는데 액체와 섞으면 냄새가 나면서 맛이 조금 난다. 그래서 다른 음료보다 커피맛이 강해서 모닝커피랑 같이 먹는걸 선호합니다.. 제품의 크기에 비해 가격이 합리적이었어요.
지금까지 불만이 없습니다. 결과는 두고 봐야 합니다. 그것은 맛이 없다. 나도 그게 큰 일이었다. 내가 시도한 다른 모든 것은 정말 이상한 맛이었습니다. 모닝 커피를 마실 때 이상한 맛을 원하지 않습니다. 쉽고 빠르고 완벽하게 용해되어 커피에 덩어리가 없습니다.
좋은 콜라겐 함량, 섭취 목적이 예방이 아니라 특정 문제의 해결이라면 최소 10g입니다. 나는이 콜라겐이 즉시 용해되고 덩어리를 형성하지 않기 때문에 좋아합니다. 적당히 뜨거운 커피에 넣으면 액체에 가라 앉고 저을 필요조차 없습니다. 맛도 냄새도 없습니다. 30일이면 충분합니다.
나는이 건강 보조 식품을 좋아하기 때문에 처음으로 복용하지 않고 마지막으로 복용하지 않습니다. 품질과 이점은 실제 사용 경험을 통해 확인됩니다. 맛은 만족합니다. 성분 구성은 만족스럽습니다. 편리한 부분과 권장 빈도. 개선되고 있습니다. 연령별 용량 조절이 가능합니다. 또 다른 장점은 포장, 복용량 및 크기입니다. 우크라이나어 리뷰를 지원해 주셔서 감사합니다!!!!"
"https://cloudinary.images-iherb.com/image/upload/f_auto,q_auto:eco/images/tmr/tmr00747/v/10.jpg","Trace Minerals ®, 이온성 비오틴 + 콜라겐, 딸기 망고, 75,000mcg, 59ml(2fl oz)",Trace Minerals ®,"₩21,344",₩662/제공량,계량 스포이트를 사용하여 매일 2ml(1/4티스푼)씩 주스나 음식에 추가하거나 원하는 만큼 바로 복용하십시오.,임신 또는 수유 중이거나 약물을 복용 중이거나 질병이 있는 경우에는 반드시 의료 전문가와 상담하십시오. 어린이의 손이 닿지 않는 곳에 보관하십시오.,2.0ml,"나는 콜라겐과 비오틴의 복용량이 마음에 들었고 냄새와 맛은 거의 중립적이며 포장은 매우 편리하며 용해성 형태, 디스펜서 및 방출 형태입니다. 디스펜서 피펫은 필요한 용량을 입력하는 데 편리합니다. 머리카락과 손톱에 필요한 1형 콜라겐과 관절 유연성을 위한 3형 콜라겐을 함유하고 있다는 것이 장점이다. 제품의 질과 성분을 얼굴에 바르고 피부가 더욱 탱탱해졌으면 좋겠습니다."
